User ID,Follower Count,Following Count,Account Active Since,Feedback
I163YK03O,"14,496",379,2020-08-08,"bro the ads in between reels are so annoying, kills the whole vibe"
5NF4ZW9XA,"31,803",220,2021-10-31,Started noticing I reach for my phone specifically to open IG even when there's no notification
53YKYYDU3,381,"1,710",2023-06-22,I tried the 30 min daily limit and blew past it every single day this week
Z5EHR07N8,"34,048","1,104",2019-05-26,the explore page is just rage bait and drama clips now. what happened to this app
L13VCG8D2,"1,759","1,709",2025-09-13,bro the algorithm just feeds me absolute garbage and I still can't look away
GKIKR2OMR,233,960,2020-02-21,Broadcast channels are a great addition. Love getting updates from creators.
9RTD6ENMB,126,"1,997",2016-10-21,The feed is so addictive that I forgot to eat lunch today. Not even exaggerating.
8N2R48TWQ,414,227,2025-08-24,My attention span is actually shot because of this app
G9ZQYAHUL,"10,044","1,739",2024-04-06,My husband literally hides my phone at night because of this app
L4ZKLOOKE,91,302,2025-04-24,there's a new ad format every month and each one is more annoying than the last
H4A3YJTU7,337,"1,805",2019-08-28,The fact that ads auto play with sound in stories is a hostile design choice
6V3JR1NJK,480,"1,878",2024-11-26,Can't help myself from opening the app but when I do it's just ads and brain rot content
JRPE2XN9T,"2,891","1,598",2020-01-13,Sponsored reels are ruining the experience. Just let me watch organic content.
CFZW0LDAL,132,"1,202",2022-02-25,The fact that you can't skip some ads feels like a punishment
NBHGFB2FL,76,537,2019-02-17,The short form content is rotting my brain I swear
SX0BJCKJC,"86,188","1,358",2022-10-14,I swear there are more ads than actual content from people I follow
3IEDD070E,287,"1,391",2023-01-17,The text size in captions got smaller and it's hard to read now
TGU8TL777,290,"1,392",2019-09-04,"The feed is a trap — you scroll because the algorithm hooks you, then ads ambush you every few posts"
62HDXC6RI,"17,039",461,2019-09-25,Reels are way too addictive. I keep watching even when I don't want to.
KZGGM0J36,"4,476","1,778",2020-11-14,The ad experience on Instagram is now worse than Facebook and that's saying something
2VFHD7WG1,389,"1,454",2018-06-07,The notes feature on DMs is a cool way to share quick thoughts with friends
9DXOQ8JXL,70,"1,688",2024-12-02,Addicted to the content loop but the advertising interruptions are getting more aggressive weekly
AW4OTUO4U,"2,504","1,554",2018-11-10,I appreciate how easy it is to share posts to stories. Smooth UX.
V4KFQ5DZ5,"2,826","1,653",2025-12-09,Instagram turned from a creative platform to a time-wasting machine
PV0V6443K,64,697,2019-11-08,UI feels cluttered with all the new shopping tabs and features nobody asked for
B3YYM33MG,162,"1,991",2022-07-09,Content discovery through the explore page is actually pretty good for my interests
Z4UR2YUPM,460,809,2022-07-14,Can't stop watching reels but every 4th one is an ad and it's getting old fast
11ZSB8LV6,100,884,2018-09-05,Cross posting to Facebook from Instagram is buggy and fails half the time
RXHW0IC1L,70,695,2017-01-09,Every third story is a sponsored post now. It's getting ridiculous.
CSG4OFDTR,"1,737","1,227",2019-03-31,90% of my feed is random reels from accounts I don't follow. Where did my friends go?
07Q2JBTZG,"3,158",159,2024-03-30,I've started unfollowing brands I actually like because their sponsored posts are too much
L0YQZDUBB,396,582,2017-03-02,I'd pay a monthly subscription to remove ads at this point honestly
EAXYLNFXJ,"3,045",671,2020-06-23,I came for photography but now it's just memes and clickbait videos
ZEH3RPRGY,399,769,2020-09-15,This is the only app where I feel genuinely creative sharing content
OV9WXHVY3,"7,650","1,661",2024-06-23,so the strategy is make reels addictive enough that people will sit through 10 ads an hour? cool
ZQPPOAU8P,"11,682","1,342",2025-03-29,Instagram live is my favorite way to interact with creators in real time
XFSHWZSJQ,5,444,2018-04-03,The ability to pin posts on your profile is a small but great feature
D3GO8JN42,"42,098",807,2017-12-30,The ads are so frequent they literally break my scroll rhythm
D0XQTQV8E,"19,099","1,154",2016-04-29,My biggest complaints: too addictive and too many ads. Basically they nailed being annoying AND irresistible.
7BTI1RIMV,"8,067","1,914",2021-05-22,The shopping feature is super convenient. Found some great small businesses through it.
8E9RIVH6T,"48,992","1,512",2018-12-16,Loading times have gotten worse since the last update. Everything feels slower.
JZTO7D835,141,444,2020-08-14,The number of ads has gotten completely out of hand. I can't scroll 3 posts without one.
R7GOKLVA2,"1,722","1,885",2025-09-08,The image quality on posts has improved a lot. Compression used to be awful.
QXIWE6RGL,"3,213",979,2022-11-25,Caught myself watching a reel about something I have zero interest in for 10 min straight
5QMKTGV44,258,"1,719",2020-03-10,Best app for keeping up with what my friends are doing. Nothing else compares.
PJA1WJ0TP,"13,587","1,887",2025-06-05,Cannot recover my old account even with proper ID verification. Support is useless.
F0TJ5JGZC,378,"1,727",2016-09-22,Basically an advertising platform with some social features attached at this point
7O75RH8LX,73,686,2025-09-04,The map search for discovering local spots is underrated. Love it.
6LH07BA7D,75,768,2017-04-01,Why does the app crash every time I try to go live? This has been broken for months.
B537QO4Z5,138,545,2024-07-05,The guides feature for organizing content is really underutilized but great
PGF7MVQ35,"51,506","2,000",2023-10-13,I find myself watching the most pointless content and can't stop. It's alarming.
VPYMB5M9J,"3,857","1,317",2023-02-04,The low quality content is drowning out actual creators who put in effort
E5C5JO5L0,340,758,2016-09-14,So addicted to scrolling but the ad frequency is driving me insane. Pick a struggle Instagram.
73NKBF2E6,598,705,2021-12-09,Love the close friends story feature. Great for sharing with a smaller group.
W5Q52DEZH,69,115,2021-12-02,The dopamine loop keeps me here but the ad bombardment is pushing me toward a breaking point
Z0XV6DDD2,332,189,2022-08-11,Low quality content loop + excessive advertising = worst combo. But I still can't close the app.
LKD4QJD7B,138,770,2016-06-10,The grid layout for profiles is iconic and I hope they never change it
YO6ILVB8D,"2,399",846,2020-11-20,My screen time is through the roof and at least a third of it is watching ads I didn't ask for
N04FDTZJ2,58,435,2016-01-18,I keep getting ads for products I already bought. Your targeting is broken.
QXPH1Y3BQ,"15,351","1,185",2021-12-16,The ad load on Instagram is worse than cable TV at this point and I'm not even joking
OYYKCZF2T,253,"1,818",2023-08-26,Getting ads in my notifications tab now? Really?
XSNHFT4I2,57,657,2022-08-24,Half the stuff on my feed is just AI generated garbage now
9SB5MBZGJ,154,"1,872",2016-06-24,I deleted the app three times this month and keep reinstalling it. That says something.
37IC0LZIG,83,947,2024-01-16,I've become dependent on this app for entertainment but the advertising is ruining it
SMWPQ82K8,383,"1,164",2020-05-26,Two factor authentication locked me out of my own account permanently
5JTV75SSU,428,"1,811",2016-12-07,Creators I follow are posting more sponsored content than genuine posts. Platform problem.
D0W9RY79K,277,"1,090",2024-09-08,The amount of sponsored content from influencers + platform ads is overwhelming
TP3174GU6,"3,703","1,260",2024-03-27,Not sure why I'm getting baby product ads when I'm 22 and single but ok
BPGYVYV2G,"2,213","1,451",2022-03-29,The new collaborative posts feature is great for working with other creators
K4SNV9RR4,"1,199","1,565",2017-12-27,Advertising on IG has become so intrusive it's pushing me toward less ad-heavy apps.
I8XQ6TCLK,28,"1,037",2022-10-06,This app has eaten my entire weekend. I opened it to check one thing and 4 hours disappeared.
ZUBLEKVL9,"3,559",123,2022-04-21,The music integration in stories and reels is seamless. Really well done.
RMF6M8WNL,163,"1,679",2023-06-15,I've started reflexively swiping past everything because so much is sponsored
IYM90PKR1,"14,562",704,2017-03-21,I discovered my favorite artist through Instagram explore. The algorithm worked perfectly.
KQTQ36ZPM,69,"1,437",2021-02-06,Really enjoy the photography community here. Great inspiration daily.
1BGMY4IQZ,484,"1,616",2023-08-02,Started setting a timer before opening IG because otherwise I lose hours
OULWOZQ48,"2,554",93,2019-11-06,The Reels feature is actually amazing for discovering new music and recipes
WUSXLMT2P,442,"1,268",2023-01-10,Every small business page I visit triggers a flood of similar ads for weeks
QM6UT6FIZ,811,"1,349",2018-01-25,The content is getting worse but somehow I'm spending MORE time on the app
TD9JYJ3CT,"28,942",370,2023-05-23,The comment filtering is too aggressive. Normal comments are being hidden.
YSX9OJWUD,86,549,2023-06-01,Ads between every 2 reels is not an acceptable user experience
JWK6Z0HR9,133,"1,502",2025-02-20,The pre-roll ads on IGTV/Reels are the worst feature ever added to this app
EA329HF1P,156,"1,720",2024-02-09,I literally cannot stop scrolling. It's 3am and I'm still on Reels.
8Y0423H7T,"17,100","1,407",2021-02-25,The content loop is toxic. You keep scrolling hoping for something good but it never comes.
FMPRYFZMY,"1,097","1,864",2022-12-06,The ASMR and cooking content on Reels is genuinely relaxing and enjoyable
77LDM1VL7,117,456,2021-05-18,Bottom navigation bar keeps changing every update. Please just commit to a layout.
YWGD4X4PZ,"1,663","1,810",2019-03-01,Would genuinely pay for a version that limits my usage because I can't control myself
K8EVBRX8U,465,"1,136",2021-02-10,"My feed used to be inspiring, now it's just dopamine farming content"
FBMENUI3D,443,765,2018-06-16,Why am I seeing ads for things I talked about out loud? It's creepy AND excessive.
GOUIFEZAC,188,627,2018-11-14,My feed is basically a shopping catalog now with some friends' posts sprinkled in
867KBQNXP,"8,118","1,002",2025-07-21,It's all stolen content from TikTok and YouTube Shorts now. Nothing original.
XLRGNJZM3,327,99,2021-12-15,Even suggested posts are basically ads disguised as recommendations now
NZEI3ZRRH,413,"1,924",2020-12-11,There's no curated experience anymore. Just a firehose of random low effort content.
86ZJQ7W7J,"4,099",814,2025-05-19,bro I set an alarm to remind me to stop scrolling. that's how bad it's gotten.
1J55CUK5X,422,480,2018-09-12,"my feed is 40% friends, 30% suggested posts, 30% ads. cool priorities instagram"
LWJOJAFI4,864,"1,983",2025-03-12,I wish there was a way to limit myself because I clearly can't do it alone
BVPXNOJMG,76,"1,840",2016-01-23,I counted 8 ads in my stories queue this morning. Eight. Come on.
CIJJRX3XH,"44,451",444,2020-04-29,My friends and I all agree the content has gotten worse but we're all still here somehow
WB2SEREV3,134,"1,012",2016-03-01,Half my stories feed is literally just ads. It ruins the whole experience.
91IPWH0MX,98,800,2025-11-28,Can we get font size options? The current size doesn't work for everyone.
61IAOIM45,303,"1,724",2017-11-16,Every reel just leads to another one and suddenly it's been 2 hours
UUZPEAL2W,"3,737","1,558",2019-01-19,There's no way to opt out or reduce ad frequency and that's trash
7DYPMLVAK,19,"1,123",2024-03-07,My account got disabled for no reason and support is impossible to reach
1ENNGAY37,475,506,2024-12-10,The unskippable video ads in reels are infuriating. YouTube vibes now.
JUL7W8COF,231,"1,972",2016-06-27,The filters and editing tools have gotten so much better. Love the creative options.
5YZ7VXUQD,"13,735","1,383",2022-11-23,I don't even enjoy the content anymore. I just scroll out of habit.
PGG6N6975,"5,388","1,382",2021-01-15,The colors and contrast on the new update hurt my eyes honestly
2VWMD5TFU,"93,233","1,013",2023-10-28,It's designed to waste your time. The infinite scroll is evil genius honestly.
6WEGGH02W,"12,809","1,991",2018-11-25,The insights dashboard for business accounts is missing important metrics
SXPNNGH8R,"2,408","1,006",2021-01-14,Some of these ads are straight up scams and Instagram doesn't seem to care
2F7GFPPSY,"2,510",689,2025-12-01,The algorithm keeps pulling me back in but the ads are making every session more annoying
8K686QE7A,"64,935","1,107",2019-07-10,The double tap to like animation changed and the old one was better
XVX1BL6F6,872,"1,358",2021-06-03,Can't upload videos longer than 90 seconds on Reels. That limit is too short.
G8ON3W9HX,"4,884","1,060",2023-03-05,The explore page is a black hole. Once you're in you can't get out.
Y6YO8DJE7,149,"1,330",2018-05-11,went from enjoying the app to feeling like I'm being sold to constantly
8CAH3GDHV,"5,971","1,314",2019-12-18,The music library is limited compared to TikTok. Lots of popular songs missing.
6GMDRDSFE,257,"1,071",2017-12-16,I genuinely think Instagram is making my focus worse. Everything feels low quality.
SZ2TVHVWH,"4,079",371,2017-03-15,Really appreciate the mental health and wellbeing features like usage reminders
CAMBHWTGD,244,"1,065",2025-10-06,The app crashes when I try to upload stories with music. Fix your bugs.
VZHWJR64D,"46,573","1,299",2022-01-22,The recommended content is so addictive but also so meaningless at the same time
WF1TQV0R0,439,729,2020-12-05,Dark mode inconsistency between screens is driving me crazy
LSJWS1ZL7,184,"1,231",2021-04-18,The content is so low effort now. Just recycled TikToks and engagement bait everywhere.
SQOI2JVZH,478,997,2024-04-01,Promoted posts from accounts I've never heard of clog my entire feed.
BLWBV2IZS,357,"1,582",2019-12-22,They've made the content addictive enough that you'll tolerate absurd amounts of advertising
FCZWKGUY0,246,"1,468",2023-05-28,My mom asked me if Instagram is free because she sees so many ads now lol
QO09VS9KK,"1,947","1,576",2020-01-29,The profile grid layout looks different and I don't like the new spacing
TNYFM7VH3,239,"1,907",2020-05-27,The ad personalization is either creepily accurate or wildly off. No middle ground.
1XLAXHNOC,216,178,2020-10-05,My productivity has tanked since Reels became a thing. Not even joking.
K31AVPM6D,891,706,2023-01-26,The infinite scroll is bad enough for my productivity. Adding more ads just adds insult to injury.
L91F4X2BF,"18,858","1,785",2021-04-01,The same ad has shown up 15 times today. I don't want your protein powder.
9Q44DVVPG,476,385,2021-08-20,The sheer volume of promoted posts is ruining my daily scroll.
AEN7YJF30,290,"1,292",2022-06-08,Honestly my favorite social media app. Clean design and good content.
WR3S18WK5,377,772,2021-07-01,"I miss when this was a photo sharing app, not a content addiction machine"
MAS41RU08,"3,164","1,346",2021-04-11,this app is literally designed to keep you hooked and it works too well
SN961J88Q,"71,770","1,340",2016-07-30,The sticker and poll features in stories are really fun and engaging
IFSI159I3,"2,437",269,2024-08-23,I wouldn't mind ads if they were actually relevant to my interests
1NTMJSRD9,"42,853",802,2022-08-31,honestly feel like I'm wasting my youth scrolling through this app
AUD9K9TR7,"2,582",922,2023-03-08,I pay attention to maybe 1 out of every 50 ads shown to me. Total waste of everyone's time.
JZE1XTAR0,120,"1,734",2016-07-20,it's giving QVC channel energy with all these product ads nonstop
WFMAX9FKE,224,602,2016-05-17,I've noticed my attention span getting shorter since I started using Reels heavily
25LZSE99F,426,"1,308",2025-07-31,The stories archive feature is like a digital diary. So glad it exists.
S13C9XQYM,7,"1,937",2020-12-09,The notification system is unreliable. I miss DMs and comments all the time.
AZHXDO3GT,204,"1,575",2020-12-21,The font change is terrible. Go back to the old one please.
P9JYQN15I,"3,29,465","1,868",2024-04-20,The remix feature for Reels is creative and fun to use with friends
TFNSGPYNY,159,"1,540",2023-08-06,Group chat features are lacking compared to WhatsApp and Telegram
J0UFO2HOQ,"1,514",511,2017-04-02,The text input field in comments is way too small on my phone
DRFDX89I8,42,285,2025-01-11,Seeing the same 3 dropshipping ads on repeat is making me go insane
7LM2LW7ZR,"11,399",865,2021-08-31,Ad frequency has made me use the app less. Congrats on losing engagement I guess.
QBYG6G04J,415,"1,463",2024-02-01,Even the explore page is flooded with sponsored content. There's no escape.
A4FEJGXAA,150,174,2021-08-17,Reels have turned this into a mindless scrolling machine. No real value anymore.
WPRLPG7GV,"2,869","1,197",2024-04-24,The content quality has dropped so much. It's like a worse version of TikTok.
ABAZD84VF,131,715,2018-02-10,Every second scroll is a sponsored post. The app is basically an ad platform now.
O5XKQR4ZL,450,"1,003",2016-09-19,New update removed the ability to see who viewed my profile. Want it back.
QLGZUI1B0,"9,865",676,2025-02-20,Instagram stories are the best feature on any social media app period
948JU63LX,"27,832",225,2018-12-06,At this point I assume every other post is trying to sell me something.
P34SLQGBU,371,900,2024-05-26,I used to not mind the ads but they've tripled in the last year easily
3OZRBLH74,81,"1,038",2023-01-18,The shadowban thing is real and Instagram pretends it doesn't exist
UJ02GRXPU,343,"1,635",2017-11-07,I've become a zombie just scrolling through reels with no purpose
I0D4DMC2R,"83,740","1,472",2021-06-04,The algorithm figured out that I'll watch anything at 2am and it's exploiting that
LIM06ETCQ,388,"1,220",2019-03-18,The ad targeting used to be decent but now I'm getting random stuff I'd never buy
P9W4J66CN,"33,734",483,2020-01-03,"between influencer sponsored posts and platform ads, authentic content is maybe 20% of my feed"
FGS3JONOU,"6,503",337,2018-10-25,"Why does the app need access to my contacts, location, and microphone to function?"
LAJM3UM94,963,"1,795",2017-03-03,I spend 5+ hours daily just mindlessly scrolling. Need to get my life together.
HVQ9XD8XQ,"3,315","1,900",2016-07-01,Honestly the best app for visual storytelling. Nothing else comes close.
KNHPVRWBR,104,711,2018-05-28,The algorithm knows me better than I know myself and it's terrifying honestly
1IZ4JQI55,253,692,2019-07-07,Ads are starting to look exactly like regular posts on purpose and that's shady
PGN3S2W1I,430,"1,806",2017-06-27,Everything is too rounded now. The old angular design was cleaner.
0I32BUHBC,"18,254","1,668",2022-04-27,"Between the addictive algorithm and the nonstop ads, this app is designed to both hook you and annoy you."
TLT4Q9BC2,263,"1,464",2024-06-10,the amount of ads makes the app feel cheap and desperate for revenue
N5MRDPMBY,597,725,2025-07-24,My small business has grown so much thanks to Instagram. Genuinely grateful.
ZRR45ED5G,173,593,2025-12-22,I report misleading ads constantly but keep seeing them. What's the point?
4EY9JVB6H,"3,304",147,2025-02-13,My archive keeps losing saved posts randomly. Really frustrating.
UNWCGBSVK,"12,658","1,654",2023-08-14,I go on to check messages and next thing I know I've watched 200 reels
BJDX0PKOV,"1,089",425,2023-08-16,The way Instagram handles group chats is better than most messaging apps
RBT4OBKS3,"16,709","1,817",2021-07-12,I actually learn a lot from educational creators on here. Not all content is bad.
H207X887L,22,"1,254",2016-06-26,They've clearly prioritized ad revenue over user experience this year
6MM1ZXYVG,"10,398","1,085",2023-06-21,"The content is mindless but I keep watching, and the ads between every reel make it even more frustrating."
5Y31K88NO,"3,129","1,276",2016-11-02,Why can't I customize the bottom bar icons? Let me pick what I want there.
SG6A8MLIK,"3,827","1,840",2025-12-31,The transition from content to ad is seamless which makes it MORE annoying not less
ZREZRDYXY,83,"1,688",2025-09-20,I keep getting followed by bot accounts and there's no easy way to mass block them
MKU1GPT49,"47,915","1,033",2022-08-09,My engagement rate dropped to nothing after they changed the algorithm again
QIMQODPXN,21,"1,348",2019-01-27,Instagram is genuinely my go-to for food and travel inspiration. Content is great.
2GJR81BMQ,"5,684","1,118",2023-04-30,Promoted reels are now half my reel feed. The other half is suggested content. Zero friends.
ADHF025LO,"3,936","1,204",2021-09-23,I used to post photos. Now I just consume garbage reels all day.
HLLSHWA7S,"1,55,131","1,888",2016-03-07,"I wouldn't mind ads if there were like 3 per session, not 30."
5H0JHK0I7,317,204,2024-06-04,The content scheduling tool is unreliable. Posts don't go up at the scheduled time.
4LDIMSYJ9,58,"1,196",2023-05-05,Do they even test the ad load? Because it feels like nobody is checking this.
5S6Y5H3O0,"1,188","1,397",2019-06-08,Love the vanish mode in DMs. Smart privacy feature.
GF309HSUW,"1,254",575,2016-01-05,the way ads interrupt mid-reel now is actually hostile UX design
8LIUQDN05,195,"1,547",2024-09-05,Getting constant login verification prompts even though nothing changed on my end
AMVNCZTZO,651,496,2024-06-08,The search function is broken. I type exact usernames and they don't show up.
G77Q9VJUH,85,94,2019-01-15,My stories views dropped from 500 to 50 overnight. Clearly some shadow ban going on.
QFMUIW7J3,"1,08,134",707,2018-08-10,My screen time report is embarrassing because of this app alone
EJI4P0E4Y,"23,010",816,2020-06-19,Influencer ads + regular ads = my feed is 60% advertising at this point
OTESU2HTT,"98,167",815,2016-10-04,Reels are a time black hole AND now they're putting ads in between them? Double whammy.
NG806W819,"66,517",554,2018-03-15,Really enjoy the throwback memories feature. Brings up great old posts.
9EL8HL88K,268,"1,687",2016-10-17,bro this app is genuinely ruining my sleep schedule
IA38K0HF3,403,914,2020-07-04,Why is every other post a random reel I didn't ask for? Give me back my feed.
3RTZ5TV6G,56,"1,780",2020-12-09,Getting tired of seeing crypto and gambling ads every other scroll
EGI3QUPXB,"59,479",630,2024-12-13,The app is using way too much battery and data in the background
W48TP37V7,537,"1,913",2023-09-13,There's zero substance anymore. Just people doing dances and pointing at text.
7BFXQ7BZE,63,254,2024-06-11,Love using this app to stay connected with friends and family across the world!
TCAGRP2U4,"1,682","1,707",2016-09-05,The dopamine hit from scrolling is real. I need to seriously cut down.
N98X16F4Z,685,"1,784",2018-08-17,This app is like junk food for my brain. Empty calories everywhere.
48WUMH9NK,98,"1,985",2023-08-18,I recognize I'm addicted and the ads make me feel worse about all the time I waste here
9TOQW9JA2,310,"1,667",2019-06-14,Really wish there was an ad-free tier. Would pay for it without hesitation.
UO874OHL5,"1,718",831,2025-01-30,"Instagram support is nonexistent. No email, no phone, no human to talk to."
HSZNVP8GM,427,"1,376",2022-03-17,I literally spend 4 hours a day on this app and at least 1 hour of that is just watching ads
FU8IOGXPB,125,289,2020-07-21,Follower count keeps fluctuating randomly. Losing and gaining 100s overnight.
DBK4EPBO0,"12,939",714,2019-10-27,The amount of recycled content is insane. Same video from 10 different accounts.
83XPHX2KB,373,"1,606",2021-07-08,mindless scrolling + ad overload = Instagram in 2025. still here though somehow.
8VMUHXID4,"32,500","1,486",2018-08-11,Stop moving buttons around every update. My muscle memory is destroyed.
6FLVYWAPK,"15,525","1,168",2021-01-04,It's all engagement bait and rage bait now. Quality has completely tanked.
4X13QINF2,171,508,2023-11-12,"The notification badges are inconsistent. Sometimes they show, sometimes they don't."
ZUNQ2W9ZL,"4,249","1,455",2025-03-31,Hooked on the content but drowning in ads. It's like eating your favorite food but it's 40% packaging.
XQJ7DPFSS,454,830,2025-01-14,When is dark mode coming for the DM screen? The white background at night is blinding.
WWO8NBHNA,"15,483",642,2020-06-06,The fact that there's no 'show fewer ads' option is a deliberate choice and it sucks.
MKSLIZ63I,350,214,2018-10-06,"I waste so much time here because the algorithm is too good, but the constant ads make it even worse."
VOKQY9FLV,"18,447","1,505",2016-05-05,Every time I open IG I lose track of time completely. It's becoming a real problem.
R1SPPN74P,"31,793","1,141",2019-07-12,Ads are now auto-playing with sound in my feed. Who approved this?
ELTFEBE54,285,177,2021-12-15,Love how easy it is to create and share highlight reels from stories
G1CJ8PMOZ,"45,543","1,583",2022-08-25,I'm on this app way too much and the ads are making the experience worse during all that time I waste.
RML29Q2L4,93,590,2017-03-24,The marketplace-ification of Instagram is complete. It's just an ad delivery machine.
ZJ22PMB6X,65,411,2016-11-04,Can't stop scrolling even though every other post is an ad. It's like being trapped in a commercial loop.
7YURNZP1O,"17,267",878,2021-07-15,The DM experience is really solid. Use it more than texting at this point.
Q6PE2FDZL,282,"1,770",2024-08-22,The report system doesn't work. I've reported harassment and nothing happens.
LED1LG8Y2,"58,178","1,652",2017-12-12,I think Instagram shows me more ads than Google does across all its products combined.
8C1CQG433,"8,784",211,2021-11-04,I can't stop and there are too many ads. Those are my two bugs. Both are features apparently.
ME9WT00IV,"2,842",223,2019-02-13,This app has a hold on me but the sponsored content is getting unbearable
WCOQ5LDL7,"10,282",127,2016-04-29,"I hate that I can't stop using this app, and I hate that every 3rd thing is a sponsored post."
JRJ9R3VP8,204,316,2023-05-04,The quality of content creators has gone way down. Everyone's chasing viral moments.
