User ID,Follower Count,Following Count,Account Active Since,Feedback
THZOUTMEQ,"1,474",938,2022-01-14,"These days, recommendations are usually on point however great way to stay connected with friends
 Tbh, I find useful content regularly"
T2FES5CS9,505,1333,2024-06-12,"I guess, content feels endless and a bit shallow"
BQWRMWLMA,"44,400",873,2019-12-23,"Honestly, the reels pull me in and I lose track of time but the reels pull me in and I lose track of time"
EE346Z7WQ,"1,679",971,2020-04-24,"Sometimes, the feed is super engaging but low value though I keep scrolling way longer than I plan"
332W04NXV,"115,195",1045,2020-08-03,"Not gonna lie, the ad load feels excessive and ads interrupt the experience a lot
 Recently, ads show up way too frequently and the feed feels cluttered with promotions"
19U772NS8,996,985,2019-04-06,"Lately, I keep seeing sponsored posts every few swipes yet too many sponsored reels
 Lately, ads show up way too frequently"
Z65HUJ8KA,455,314,2017-09-06,"From my side, overall a good experience"
MKVZBDGVV,"5,148",716,2019-04-12,"From my side, navigation could be simpler however the layout feels cluttered"
4QYAHAN6C,203,942,2020-05-20,"Recently, too many sponsored reels and the feed feels cluttered with promotions
 Kind of, the feed feels cluttered with promotions so ads show up way too frequently"
OOHF59SHE,"135,773",1675,2025-04-04,"I feel like, there are too many ads in between posts"
DBDXBDEHH,"1,950",1119,2023-01-30,"Lately, navigation could be simpler but icons aren’t intuitive"
NS7EASW23,385,876,2021-02-28,"At times, great way to stay connected with friends"
HP6VZ41NA,"1,543",848,2025-07-27,"I guess, too many quick dopamine hits"
3ZCA7FXLO,"17,677",1718,2016-10-02,"These days, it’s addictive without giving much substance however I end up wasting a lot of time here
 Kind of, it’s hard to stop once I start yet content feels endless and a bit shallow"
A11DPG8SB,"1,737",298,2021-02-12,"I feel like, I open it for a minute and stay for hours"
KYHVKQXI6,"9,104",1096,2016-04-07,"In my experience, I keep scrolling way longer than I plan but content feels endless and a bit shallow
 More often than not, content feels endless and a bit shallow yet it’s addictive without giving much substance"
3ZP84JRH8,902,1623,2022-02-27,"Tbh, I’m getting more ads than actual content though there are too many ads in between posts"
BZCZJJY4M,"9,690",766,2017-03-23,"Lately, too many quick dopamine hits though the reels pull me in and I lose track of time
 Kind of, it’s addictive without giving much substance plus it hooks me more than it should"
BVPY8CRIN,"7,787",1632,2020-03-23,"Tbh, I end up wasting a lot of time here so it’s addictive without giving much substance"
8JSEUO4VK,925,522,2022-05-26,"From my side, I keep seeing sponsored posts every few swipes but ads show up way too frequently"
VON8PVWJA,"16,993",1484,2025-07-27,"Honestly, sponsored content is overwhelming
 Recently, too many sponsored reels and ads show up way too frequently"
FXV7A7KX7,"1,002",1189,2016-06-16,"For me, the feed feels cluttered with promotions but the feed feels cluttered with promotions
 Lately, there are too many ads in between posts"
XW1TBRWR9,"133,871",612,2021-07-03,"From my side, too many quick dopamine hits but it’s addictive without giving much substance
 At times, it hooks me more than it should though I keep scrolling way longer than I plan"
S13HDNH4N,273,1936,2017-03-27,"Tbh, content feels endless and a bit shallow plus it’s hard to stop once I start
 I feel like, too many quick dopamine hits"
3CCE05Z25,"9,263",450,2016-08-30,"From my side, I’m getting more ads than actual content plus the feed feels cluttered with promotions"
QIV55RCD4,"76,606",1527,2019-04-10,"I feel like, the features keep getting better plus recommendations are usually on point"
F6T8RBA2F,"17,888",1353,2023-09-30,"For me, I enjoy discovering new creators so I find useful content regularly"
U6C2H23MP,"18,544",1485,2022-10-15,"These days, there are too many ads in between posts"
746WBT3O6,"27,718",486,2020-10-04,"It feels like, stories and reels are entertaining"
FTGGZ62FE,"95,304",309,2020-12-10,"Recently, content feels endless and a bit shallow though I keep scrolling way longer than I plan"
C6H52MJ13,"1,880",360,2020-09-19,"At times, there are too many ads in between posts so the feed feels cluttered with promotions"
KMX8DHIC6,"1,580",1450,2023-09-13,"Overall, ads interrupt the experience a lot"
PHWN8DDIN,"8,716",1548,2019-06-20,"It feels like, I keep seeing sponsored posts every few swipes so the feed feels cluttered with promotions"
GLSH6GJJM,"7,531",757,2023-12-06,"I guess, my reach has dropped recently however my reach has dropped recently"
BRXDY633M,"11,656",1917,2017-06-22,"Sometimes, it’s hard to stop once I start however I open it for a minute and stay for hours
 It feels like, ads are popping up almost every scroll so the ad load feels excessive"
9JB8JXKQ0,"130,822",1852,2016-11-10,"These days, it’s hard to stop once I start
 For me, I end up wasting a lot of time here"
BKV4YKADE,749,1614,2020-07-09,"Sometimes, I keep scrolling way longer than I plan though too many quick dopamine hits
 In my experience, the reels pull me in and I lose track of time yet too many quick dopamine hits"
NZKRSN8L0,"1,273",1712,2017-08-07,"Overall, there are too many ads in between posts plus I’m getting more ads than actual content"
1K2UBPZKC,"1,865",725,2023-08-19,"It feels like, the feed feels cluttered with promotions but ads show up way too frequently"
3X1F8S0X7,"1,608",318,2019-10-20,"In my experience, content feels endless and a bit shallow"
EH8GEQLSR,"1,405",447,2017-09-21,"Honestly, great way to stay connected with friends and I like the variety of content"
2P9I13UYL,253,1754,2020-08-03,"These days, content feels endless and a bit shallow
 In my experience, the ad load feels excessive"
9IS1Z0UUF,99,1954,2022-10-16,"These days, uploads take too long"
TXLPUP0T2,"1,811",1057,2016-11-16,"Overall, stories and reels are entertaining so I like the variety of content"
HDNBRQIT4,"1,501",1566,2021-08-11,"Kind of, I keep seeing sponsored posts every few swipes so the ad load feels excessive"
CMPCBHBXF,848,134,2022-04-01,"Kind of, login issues happen randomly yet hashtags don’t seem to work well"
255KCMG2K,"142,258",99,2016-07-11,"For me, too many quick dopamine hits
 I guess, ads are popping up almost every scroll"
BSH3BVUCZ,"2,332",904,2017-06-05,"Not gonna lie, messages sometimes don’t send properly so notifications are inconsistent"
O0M24US73,"16,149",1420,2016-04-15,"Not gonna lie, it’s addictive without giving much substance however content feels endless and a bit shallow
 I guess, I keep scrolling way longer than I plan"
ZLPVBBGO2,"93,009",1043,2017-06-21,"Overall, I enjoy discovering new creators but recommendations are usually on point"
KEGJ52T2P,"1,665",1370,2024-08-26,"I guess, overall a good experience but recommendations are usually on point"
GC095VKVU,943,1692,2024-01-19,"Not gonna lie, my reach has dropped recently"
BLPXAJMK4,"7,080",226,2023-12-31,"Recently, it’s hard to stop once I start
 Lately, I end up wasting a lot of time here yet content feels endless and a bit shallow"
YUZTW32AT,"2,761",1665,2016-05-03,"These days, I end up wasting a lot of time here plus it hooks me more than it should
 I guess, too many sponsored reels but I’m getting more ads than actual content"
9ZW1Z9YUD,"18,266",234,2024-06-23,"I guess, login issues happen randomly however hashtags don’t seem to work well"
66KE6ZADO,474,1608,2023-02-12,"Kind of, ads interrupt the experience a lot yet the feed feels cluttered with promotions
 For me, sponsored content is overwhelming plus sponsored content is overwhelming"
N55V6J9RU,486,1973,2022-09-07,"These days, I like the variety of content"
PWY0TUZG2,348,225,2025-02-17,"These days, ads show up way too frequently
 Recently, the feed feels cluttered with promotions and the ad load feels excessive"
SVFK2KNEL,"12,318",61,2020-08-19,"I feel like, too many sponsored reels yet the feed feels cluttered with promotions"
61UM04ACC,"110,048",1000,2024-06-23,"From my side, it’s addictive without giving much substance
 Honestly, I keep seeing sponsored posts every few swipes however there are too many ads in between posts"
DVG7OQ2ZD,"1,897",1346,2025-05-23,"These days, I open it for a minute and stay for hours though too many quick dopamine hits
 It feels like, I keep scrolling way longer than I plan"
DGWMQEBN2,"41,310",718,2025-07-18,"These days, I find useful content regularly however it’s a nice break during the day"
D0NKVDKIP,444,1935,2021-10-19,"I guess, the app is smooth and fun to use"
4VE41W4S6,"1,182",1429,2022-07-13,"Lately, it’s addictive without giving much substance
 Honestly, the feed feels cluttered with promotions however I’m getting more ads than actual content"
DIXS5B4M6,272,1875,2021-05-13,"It feels like, I enjoy discovering new creators
 Tbh, stories and reels are entertaining"
LIYZICXHR,"1,230",1684,2017-03-03,"Tbh, stories and reels are entertaining"
AW0EWAYAJ,"68,532",103,2017-02-24,"For me, overall a good experience yet recommendations are usually on point"
MZ08N0XCS,"2,696",337,2018-05-24,"From my side, I enjoy discovering new creators so the app is smooth and fun to use"
RPHT28C8C,647,1126,2024-08-30,"At times, recommendations are usually on point however I find useful content regularly"
33IKUZU9S,"1,922",630,2020-03-07,"More often than not, there are too many ads in between posts and ads interrupt the experience a lot"
1M4I3L0Q4,544,1869,2018-03-16,"Honestly, sponsored content is overwhelming"
05SFLYG6D,"128,660",757,2022-11-10,"At times, the app is smooth and fun to use"
MHSBDJ532,876,854,2019-04-14,"From my side, sponsored content is overwhelming plus ads interrupt the experience a lot"
T3IO39WIV,"19,182",606,2020-05-16,"At times, DMs lag at times though DMs lag at times"
N6XBELKO4,"32,009",1714,2018-06-15,"It feels like, dark mode could be better"
RYIARU4HS,"104,202",1639,2019-10-01,"Overall, I find useful content regularly yet it’s a nice break during the day"
FDKNL48K6,"1,132",402,2018-05-30,"I feel like, I like the variety of content so I like the variety of content
 More often than not, recommendations are usually on point"
0OSOH5V6K,"1,301",244,2017-01-05,"Sometimes, UI changes are confusing however spacing looks off"
L879W5DY4,"1,016",1994,2017-05-11,"More often than not, sponsored content is overwhelming
 At times, I keep seeing sponsored posts every few swipes"
1MO5JMQ0N,"1,194",1346,2018-12-21,"For me, ads show up way too frequently plus ads interrupt the experience a lot
 For me, the ad load feels excessive"
EQQFLNOJK,858,629,2020-02-05,"At times, design feels inconsistent"
YS3UUI5XB,320,1471,2022-11-18,"Not gonna lie, I like the variety of content"
6Y7V62CUP,"85,101",155,2016-07-01,"For me, messages sometimes don’t send properly"
4DUSGEHN0,"18,577",1070,2024-03-19,"These days, it’s hard to stop once I start
 I feel like, the reels pull me in and I lose track of time"
89CBI2MKN,517,646,2024-10-21,"I feel like, I find useful content regularly though I find useful content regularly"
TT9KA1DLU,633,675,2024-05-30,"I feel like, there are too many ads in between posts yet I keep seeing sponsored posts every few swipes"
5X51O0LQB,"7,502",622,2022-01-28,"From my side, content feels endless and a bit shallow
 From my side, too many quick dopamine hits though it hooks me more than it should"
J5I2MT71R,470,1139,2018-06-03,"Not gonna lie, the feed feels cluttered with promotions yet too many sponsored reels
 These days, ads interrupt the experience a lot yet the ad load feels excessive"
PZD1SKZIO,"1,697",1645,2021-03-17,"It feels like, great way to stay connected with friends but I find useful content regularly
 More often than not, it’s a nice break during the day though it’s a nice break during the day"
MERNTP3CZ,38,1866,2019-12-10,"Lately, messages sometimes don’t send properly"
97DIYX02W,"2,389",1988,2021-07-26,"Tbh, navigation could be simpler"
WIV5HHQRG,269,456,2023-02-13,"Lately, too many quick dopamine hits"
FM348NI74,"106,887",991,2024-12-08,"In my experience, the feed feels cluttered with promotions"
SOYG9ZQYA,"1,189",256,2019-08-25,"Sometimes, it’s addictive without giving much substance
 Recently, the feed is super engaging but low value though content feels endless and a bit shallow"
3VC2W4054,"1,956",1402,2021-02-03,"From my side, the reels pull me in and I lose track of time
 These days, I’m getting more ads than actual content"
DB90MTXLQ,"16,160",536,2024-05-27,"In my experience, I’m getting more ads than actual content
 From my side, too many sponsored reels"
LKS2DVGON,853,465,2024-07-26,"Overall, there are too many ads in between posts however I’m getting more ads than actual content"
E3H0Y4VPW,"8,781",1699,2016-08-31,"Sometimes, too many quick dopamine hits though it’s hard to stop once I start
 In my experience, I end up wasting a lot of time here"
AV3G60992,"1,823",595,2018-01-25,"More often than not, the ad load feels excessive and there are too many ads in between posts"
QE5EEAZVW,"68,626",1586,2018-12-13,"More often than not, the ad load feels excessive plus too many sponsored reels"
5FRZUUN6X,"1,409",1081,2021-12-31,"Overall, I enjoy discovering new creators
 More often than not, I find useful content regularly and I like the variety of content"
0Z7PRB6X6,"1,303",966,2021-10-25,"From my side, ads show up way too frequently"
YYW0GAJKF,"1,790",1412,2025-06-06,"It feels like, login issues happen randomly but messages sometimes don’t send properly"
9SZJ2RQB2,720,52,2024-02-04,"More often than not, ads interrupt the experience a lot however the ad load feels excessive"
D86DFNWPN,268,1455,2018-05-20,"These days, great way to stay connected with friends though the app is smooth and fun to use"
FZAUXBGK2,"3,739",1002,2023-05-05,"Honestly, the reels pull me in and I lose track of time so content feels endless and a bit shallow"
96ALGXZJ9,558,1585,2024-07-08,"For me, the reels pull me in and I lose track of time and it’s hard to stop once I start"
XLHY4UXMW,"1,563",1900,2024-03-06,"Recently, great way to stay connected with friends
 Overall, recommendations are usually on point yet I find useful content regularly"
L1VZNQDXA,"1,297",1688,2019-04-10,"At times, content feels endless and a bit shallow
 From my side, I open it for a minute and stay for hours however it hooks me more than it should"
0TL13ICI9,52,1841,2017-06-30,"At times, content feels endless and a bit shallow
 I guess, too many sponsored reels"
3YWLPTPOM,430,214,2024-03-30,"Honestly, messages sometimes don’t send properly however messages sometimes don’t send properly"
KF6JZQF2R,42,1314,2020-07-25,"In my experience, I find useful content regularly though I like the variety of content
 At times, I like the variety of content"
UJS75ELTF,90,311,2021-08-06,"Recently, content feels endless and a bit shallow
 Recently, it’s addictive without giving much substance"
ZPR6H2U8V,"60,420",1048,2018-12-27,"Overall, I find useful content regularly though the features keep getting better
 Not gonna lie, overall a good experience"
9C245O7O7,"1,008",939,2018-08-02,"Not gonna lie, the ad load feels excessive though I’m getting more ads than actual content"
QD54AGCST,864,775,2017-06-06,"More often than not, too many quick dopamine hits so the reels pull me in and I lose track of time
 Kind of, it’s addictive without giving much substance"
8GGHTV3SY,"116,575",1960,2023-01-18,"Kind of, it’s hard to stop once I start
 Honestly, I’m getting more ads than actual content plus ads are popping up almost every scroll"
92MI560TO,"1,321",816,2022-11-22,"These days, I keep scrolling way longer than I plan so I open it for a minute and stay for hours"
1KC3L4AT6,813,1049,2017-05-23,"These days, DMs lag at times"
ASXYW1GNP,"8,087",1696,2025-11-30,"I guess, search isn’t very accurate plus followers count seems off"
A9C2LTWI0,159,631,2025-03-06,"From my side, the app is smooth and fun to use"
CLCCVGJJ1,"18,851",217,2017-07-24,"Lately, ads interrupt the experience a lot however the feed feels cluttered with promotions"
Q5GQQLYZJ,"2,758",337,2017-05-03,"I guess, it hooks me more than it should yet I keep scrolling way longer than I plan"
G1A0774RZ,"1,379",269,2018-01-10,"Sometimes, it hooks me more than it should though the feed is super engaging but low value"
H8QFDTN0P,166,546,2017-10-27,"It feels like, the reels pull me in and I lose track of time"
LR0LU57BQ,"15,551",1941,2019-02-21,"Kind of, the app is smooth and fun to use though I enjoy discovering new creators"
S43C5BA75,"1,174",878,2023-12-16,"I guess, I end up wasting a lot of time here and content feels endless and a bit shallow
 For me, content feels endless and a bit shallow plus the reels pull me in and I lose track of time"
OXTFDC79F,"1,201",1349,2024-07-23,"Lately, I end up wasting a lot of time here"
DF9SSEQ7W,769,1493,2023-01-12,"Overall, search isn’t very accurate though DMs lag at times"
4JY908QDW,"79,519",1321,2023-12-28,"Recently, the features keep getting better"
AU36P67U2,"104,524",1683,2025-10-30,"Kind of, I enjoy discovering new creators
 Recently, the features keep getting better though I find useful content regularly"
SGY7VCNEA,"1,862",1082,2023-09-04,"I guess, it’s hard to stop once I start
 Tbh, too many quick dopamine hits"
A2YMPYI46,"1,533",1974,2025-11-03,"I feel like, ads show up way too frequently however ads show up way too frequently"
YUCF6WXQG,217,1388,2023-04-07,"Overall, stories and reels are entertaining so overall a good experience"
3ZNP8KAIW,"1,284",1385,2017-04-11,"I guess, it’s addictive without giving much substance so the feed is super engaging but low value
 From my side, the feed feels cluttered with promotions"
P4LEW4P22,"15,620",1043,2016-07-09,"In my experience, UI changes are confusing"
OUJB9NDXS,141,94,2018-03-21,"These days, the ad load feels excessive
 More often than not, the ad load feels excessive but I keep seeing sponsored posts every few swipes"
GIL0MVZMU,"1,942",435,2025-05-20,"It feels like, too many quick dopamine hits yet I keep scrolling way longer than I plan
 Overall, it’s addictive without giving much substance though I open it for a minute and stay for hours"
KB9OI0D4D,137,1210,2024-12-25,"At times, I open it for a minute and stay for hours so the reels pull me in and I lose track of time"
ZXII6L3UE,"3,725",417,2018-07-03,"At times, I keep scrolling way longer than I plan
 For me, I end up wasting a lot of time here"
QB09UW8PD,"13,734",331,2022-05-20,"More often than not, ads interrupt the experience a lot and I’m getting more ads than actual content"
TW1PUWSNF,"1,403",1617,2019-05-14,"I guess, it hooks me more than it should plus the reels pull me in and I lose track of time"
4E8QENVGU,"1,071",931,2019-12-19,"Overall, the app is smooth and fun to use"
789RDJAK2,"1,404",694,2019-02-24,"Kind of, too many sponsored reels yet sponsored content is overwhelming
 Overall, there are too many ads in between posts"
MFJE50QYR,"12,057",1195,2023-12-19,"Overall, sponsored content is overwhelming though ads show up way too frequently
 I guess, I’m getting more ads than actual content"
32HMEPDMB,"1,858",150,2022-03-07,"For me, there are too many ads in between posts
 It feels like, ads show up way too frequently"
QOQSD8P4X,612,766,2023-05-30,"It feels like, I keep seeing sponsored posts every few swipes
 I feel like, sponsored content is overwhelming however sponsored content is overwhelming"
7F1UP4PHF,"1,324",958,2018-07-04,"In my experience, I end up wasting a lot of time here
 More often than not, I’m getting more ads than actual content and ads are popping up almost every scroll"
39SYIED48,196,1121,2025-11-23,"Lately, I’m getting more ads than actual content though the feed feels cluttered with promotions"
2SDS8B25S,"1,974",113,2016-09-06,"It feels like, it hooks me more than it should and I open it for a minute and stay for hours"
L4OESRSBZ,"1,880",910,2021-12-20,"For me, content feels endless and a bit shallow but content feels endless and a bit shallow
 Honestly, the feed is super engaging but low value"
5NMTVZ2GP,650,337,2017-07-18,"These days, I find useful content regularly though stories and reels are entertaining
 At times, I find useful content regularly"
Y5MIHA8ZP,139,123,2019-07-03,"Recently, recommendations are usually on point"
1EAF3IHSW,"1,354",1217,2020-05-02,"Honestly, the layout feels cluttered though the layout feels cluttered"
JMAS41RU0,"62,909",1270,2025-07-28,"For me, sponsored content is overwhelming"
UH9WL4B73,"19,893",1910,2016-10-06,"More often than not, the features keep getting better so the features keep getting better
 More often than not, I find useful content regularly though I find useful content regularly"
GD4HKPWI2,"109,872",1387,2025-08-06,"From my side, too many sponsored reels and ads show up way too frequently
 I guess, I keep seeing sponsored posts every few swipes"
2VP6F0O7Y,"3,639",597,2016-06-25,"Sometimes, the feed is super engaging but low value
 Lately, it’s addictive without giving much substance so it hooks me more than it should"
TVOAV41B8,"1,521",1234,2017-10-23,"More often than not, I find useful content regularly so I enjoy discovering new creators
 These days, recommendations are usually on point"
SM1PPYZ8J,"1,620",407,2021-07-27,"It feels like, buttons are hard to find so navigation could be simpler"
ZOIM2CAML,"118,471",1773,2020-10-28,"Lately, I’m getting more ads than actual content
 Overall, ads show up way too frequently"
RKF4HT69A,"12,429",1730,2021-04-08,"Tbh, ads show up way too frequently but sponsored content is overwhelming
 In my experience, the ad load feels excessive but the feed feels cluttered with promotions"
N0ABMKRY7,"1,398",1315,2017-12-20,"Tbh, ads show up way too frequently however I keep seeing sponsored posts every few swipes"
0MX7ACCDZ,"4,456",1062,2025-11-07,"Tbh, I enjoy discovering new creators so it’s a nice break during the day"
H7YD9MIZN,"1,884",229,2019-03-24,"From my side, the reels pull me in and I lose track of time
 Lately, sponsored content is overwhelming"
TOS7CUWB3,"1,067",1283,2018-06-26,"Not gonna lie, ads interrupt the experience a lot plus the feed feels cluttered with promotions"
P5TB94874,994,1035,2018-05-25,"More often than not, I keep scrolling way longer than I plan and it hooks me more than it should
 For me, I end up wasting a lot of time here however too many quick dopamine hits"
MOU803JW6,"1,938",1994,2023-10-13,"Overall, the ad load feels excessive
 Sometimes, too many sponsored reels and there are too many ads in between posts"
DUDUYMTGR,"1,124",124,2025-10-11,"For me, search isn’t very accurate"
S5R25ZFC1,"1,990",1448,2018-11-12,"Recently, ads are popping up almost every scroll and the ad load feels excessive
 Overall, ads are popping up almost every scroll"
LECFDMILA,429,1524,2024-08-27,"I feel like, ads show up way too frequently
 Overall, there are too many ads in between posts"
LGJVBVXVR,"122,672",1291,2021-12-07,"It feels like, the feed is super engaging but low value
 For me, the reels pull me in and I lose track of time"
GIYI04CVU,"1,328",1298,2017-08-23,"These days, there are too many ads in between posts
 It feels like, ads show up way too frequently yet there are too many ads in between posts"
6LDINUSMJ,"1,922",1359,2016-07-05,"For me, I keep seeing sponsored posts every few swipes yet there are too many ads in between posts
 In my experience, sponsored content is overwhelming"
HVJ4UMSG9,"1,311",571,2025-03-17,"These days, I end up wasting a lot of time here
 Overall, I keep seeing sponsored posts every few swipes"
PSQ0OXFQ8,"1,418",864,2023-04-15,"Lately, content feels endless and a bit shallow"
Z4GW43KIJ,781,1211,2021-03-17,"In my experience, search isn’t very accurate"
2595EY494,"55,533",925,2020-07-22,"Lately, the features keep getting better"
3JN050E6M,"1,072",180,2018-12-13,"Lately, I open it for a minute and stay for hours so I keep scrolling way longer than I plan"
XRQLOTEFX,"105,750",106,2018-09-15,"In my experience, I end up wasting a lot of time here
 Not gonna lie, ads interrupt the experience a lot so sponsored content is overwhelming"
8H23TU8LM,"106,189",647,2023-04-17,"I feel like, there are too many ads in between posts though ads interrupt the experience a lot"
N5TNA623B,"1,698",92,2017-02-14,"Honestly, great way to stay connected with friends
 These days, great way to stay connected with friends"
I91PY9T27,"7,393",1596,2024-01-21,"It feels like, I enjoy discovering new creators so I like the variety of content"
OORMR9P95,"1,447",1555,2023-09-21,"For me, the reels pull me in and I lose track of time but content feels endless and a bit shallow
 Honestly, sponsored content is overwhelming"
9QB0E7CXS,814,940,2024-05-03,"In my experience, sponsored content is overwhelming"
F72334NLX,"7,027",1823,2021-05-16,"More often than not, the feed feels cluttered with promotions and the ad load feels excessive"
8PFKPOVYH,"127,424",59,2023-08-17,"In my experience, the feed is super engaging but low value
 At times, I keep seeing sponsored posts every few swipes"
7TSPP0LK5,"1,242",1770,2019-06-27,"I guess, it’s a nice break during the day
 For me, stories and reels are entertaining"
HRQAP5IPI,"144,027",355,2022-06-07,"Honestly, it hooks me more than it should
 It feels like, too many quick dopamine hits though it hooks me more than it should"
QR5U83YGM,"1,308",161,2017-09-07,"Kind of, I end up wasting a lot of time here plus it hooks me more than it should
 It feels like, too many sponsored reels"
52713T87K,"90,092",999,2020-10-02,"At times, I end up wasting a lot of time here yet I open it for a minute and stay for hours"
