User ID,Follower Count,Following Count,Account Active Since,Feedback
DSYM7D019,"1,468",403,2018-04-06,"From my side, overall a good experience
 From my side, stories and reels are entertaining plus I find useful content regularly"
HEXW8L85J,"1,839",1302,2019-04-22,"Kind of, I keep scrolling way longer than I plan
 Sometimes, the feed is super engaging but low value"
25Z8KQ86Y,483,510,2018-10-02,"Recently, ads interrupt the experience a lot
 Overall, ads show up way too frequently plus I’m getting more ads than actual content"
91QUPWCKH,"10,135",782,2023-06-01,"From my side, the feed is super engaging but low value
 Not gonna lie, I open it for a minute and stay for hours"
EM2FITGUK,964,719,2025-09-18,"I feel like, the feed feels cluttered with promotions though too many sponsored reels"
OC6UZHR5X,285,555,2024-05-09,"Recently, it’s addictive without giving much substance though it hooks me more than it should
 I feel like, too many quick dopamine hits plus I keep scrolling way longer than I plan"
SE3V3CZBS,"1,775",731,2019-09-30,"Honestly, I enjoy discovering new creators
 Kind of, I find useful content regularly"
CPY34QN5Y,"61,458",1396,2016-04-14,"Honestly, ads are popping up almost every scroll
 From my side, I keep seeing sponsored posts every few swipes however the feed feels cluttered with promotions"
1ZY6N78JP,"9,064",1345,2021-04-06,"Honestly, the feed is super engaging but low value
 Sometimes, the ad load feels excessive plus ads are popping up almost every scroll"
KRPC3YVR7,"1,920",1629,2023-12-06,"Sometimes, the feed feels cluttered with promotions so I’m getting more ads than actual content"
4X1I5482Q,"144,534",1597,2017-04-19,"These days, the feed feels cluttered with promotions so I keep seeing sponsored posts every few swipes"
SQRY1EYN7,"9,487",917,2021-06-30,"I feel like, content feels endless and a bit shallow
 I feel like, the feed feels cluttered with promotions"
O57KP44RV,985,1206,2024-02-25,"Tbh, the reels pull me in and I lose track of time
 Honestly, I keep seeing sponsored posts every few swipes"
B2NZNX9GW,"1,180",255,2020-07-24,"More often than not, ads are popping up almost every scroll"
5EDM228GN,"7,900",1121,2023-04-15,"In my experience, recommendations are usually on point so the features keep getting better
 Lately, it’s a nice break during the day"
77BMBVMOU,"14,458",1030,2017-12-22,"At times, there are too many ads in between posts but ads are popping up almost every scroll
 Honestly, the feed feels cluttered with promotions however the ad load feels excessive"
2KKZMPJRH,"1,910",1201,2023-10-22,"Recently, it’s hard to stop once I start however it’s addictive without giving much substance
 Tbh, too many quick dopamine hits but I keep scrolling way longer than I plan"
UO5NYMMFU,340,843,2023-08-30,"Not gonna lie, the ad load feels excessive
 Honestly, ads interrupt the experience a lot"
YZXJQYJV8,"2,404",289,2024-08-23,"Lately, it hooks me more than it should though the reels pull me in and I lose track of time"
D1ZODXRK6,"1,618",589,2018-06-19,"Honestly, ads show up way too frequently yet ads show up way too frequently
 In my experience, I’m getting more ads than actual content plus too many sponsored reels"
G6W04YGYF,932,340,2016-02-22,"It feels like, it hooks me more than it should but I end up wasting a lot of time here"
DX0BNH36W,"1,911",1012,2018-01-05,"Not gonna lie, app crashes occasionally so messages sometimes don’t send properly"
AFQSDQ26R,"1,529",793,2022-04-21,"Recently, I open it for a minute and stay for hours but it’s addictive without giving much substance"
85I0HIVTQ,"13,162",1671,2016-12-17,"Kind of, the feed is super engaging but low value however it hooks me more than it should
 For me, too many quick dopamine hits but it’s addictive without giving much substance"
BNZ72WUMA,"146,188",1802,2024-02-08,"Not gonna lie, great way to stay connected with friends"
75AUD9K9T,"1,922",324,2025-07-17,"At times, I open it for a minute and stay for hours plus the reels pull me in and I lose track of time
 For me, I end up wasting a lot of time here"
MGW5JM8PF,190,1916,2017-07-11,"Lately, search isn’t very accurate so login issues happen randomly"
88ELNWOSK,"1,463",1477,2020-08-26,"Lately, I keep scrolling way longer than I plan and the feed is super engaging but low value
 It feels like, I keep scrolling way longer than I plan and it’s addictive without giving much substance"
S1CXDCWGK,"84,412",654,2023-12-20,"In my experience, I’m getting more ads than actual content plus ads interrupt the experience a lot
 I feel like, ads are popping up almost every scroll"
PQRW6T77V,"1,472",867,2017-01-23,"Not gonna lie, too many sponsored reels but ads are popping up almost every scroll"
2CUDLD5CX,60,1023,2019-09-06,"Not gonna lie, icons aren’t intuitive"
6RQGKCUMC,"17,097",578,2021-04-22,"Recently, I open it for a minute and stay for hours
 These days, it’s addictive without giving much substance so I end up wasting a lot of time here"
DT94G8V9Z,"6,355",730,2017-12-19,"Kind of, I open it for a minute and stay for hours and it’s addictive without giving much substance"
MGFXC08DT,929,748,2017-10-06,"Sometimes, I end up wasting a lot of time here"
VXC8ACT49,"43,469",1068,2021-06-15,"I guess, my reach has dropped recently"
NXSKYZ86I,"1,025",963,2016-02-06,"Kind of, the feed feels cluttered with promotions
 Lately, there are too many ads in between posts"
QSU95IYUB,"16,038",697,2025-03-28,"Recently, the feed feels cluttered with promotions"
VU6Z5GF3B,"1,100",1869,2024-11-24,"These days, I end up wasting a lot of time here
 From my side, it’s addictive without giving much substance"
UV1FFOFQ1,"1,145",138,2016-09-29,"Kind of, the feed feels cluttered with promotions"
DR90RXCIO,848,1796,2024-03-06,"Kind of, hashtags don’t seem to work well however followers count seems off"
V7AENRIOU,67,788,2025-10-08,"I feel like, it’s hard to stop once I start however I end up wasting a lot of time here
 Recently, I keep seeing sponsored posts every few swipes"
9FQ9TEA71,"141,610",705,2017-10-01,"Honestly, too many quick dopamine hits
 In my experience, I open it for a minute and stay for hours"
SGT6LKWKN,"19,165",1737,2025-10-16,"From my side, the feed is super engaging but low value but content feels endless and a bit shallow
 For me, I keep seeing sponsored posts every few swipes"
LB5Y97LA7,356,1707,2020-04-18,"Tbh, design feels inconsistent yet UI changes are confusing"
QHS9CKHAW,"7,080",103,2016-08-01,"Kind of, spacing looks off plus dark mode could be better"
LM6S0ZIUQ,"80,051",1379,2016-06-07,"In my experience, ads show up way too frequently yet the feed feels cluttered with promotions"
A1I10PKAP,"100,367",703,2021-05-19,"Not gonna lie, ads are popping up almost every scroll
 These days, I’m getting more ads than actual content"
XXK7TTMA0,"3,027",1313,2022-07-08,"Tbh, buttons are hard to find plus the layout feels cluttered"
E1UGGJMQ6,"1,323",1272,2019-07-31,"In my experience, followers count seems off"
1VO4WQXJB,"18,080",801,2024-09-15,"At times, I like the variety of content however stories and reels are entertaining"
G75ZK1GA2,"1,375",1894,2022-02-26,"Lately, content feels endless and a bit shallow
 From my side, there are too many ads in between posts"
Z1BNZHO7Z,"146,309",719,2021-07-23,"At times, ads interrupt the experience a lot so I’m getting more ads than actual content
 More often than not, I’m getting more ads than actual content"
DUT076G5G,"129,602",863,2024-11-01,"It feels like, it’s hard to stop once I start"
SVOLTRJKL,685,350,2016-11-21,"Overall, I’m getting more ads than actual content
 It feels like, I’m getting more ads than actual content"
YMBNBOR7A,"1,169",927,2025-03-30,"Tbh, ads show up way too frequently"
7RP422TA8,"17,796",298,2022-05-12,"Sometimes, content feels endless and a bit shallow"
JPDT12SBA,"123,878",894,2022-03-18,"Overall, the reels pull me in and I lose track of time so the reels pull me in and I lose track of time"
GVTN4YPKW,"132,328",253,2016-12-24,"These days, the reels pull me in and I lose track of time"
30ZBTVFH7,"1,521",962,2016-02-15,"Recently, ads interrupt the experience a lot plus ads interrupt the experience a lot"
J5UGE1G41,808,1351,2025-05-17,"In my experience, it’s addictive without giving much substance however I end up wasting a lot of time here
 Recently, content feels endless and a bit shallow"
HJQMQU4HK,423,783,2021-07-08,"Lately, too many sponsored reels so too many sponsored reels"
JH6ZAZ505,"1,508",904,2021-07-23,"From my side, icons aren’t intuitive and design feels inconsistent"
A1FWT9UA0,"103,160",1343,2024-09-20,"Sometimes, it’s hard to stop once I start but I end up wasting a lot of time here
 Overall, it hooks me more than it should"
VZA9RODEI,"17,701",1232,2025-11-29,"I feel like, ads are popping up almost every scroll so sponsored content is overwhelming"
GAF0T9L0G,"91,931",1109,2020-11-24,"Tbh, the features keep getting better though great way to stay connected with friends"
37V3869OJ,344,833,2018-04-02,"I feel like, ads are popping up almost every scroll yet sponsored content is overwhelming"
3UN69YDYV,"1,557",797,2025-02-25,"These days, great way to stay connected with friends
 Not gonna lie, recommendations are usually on point"
CX5J1IIPN,991,1069,2020-12-24,"Not gonna lie, I end up wasting a lot of time here
 I feel like, sponsored content is overwhelming"
E74T355HS,"1,931",1242,2020-02-04,"Lately, the features keep getting better but I enjoy discovering new creators"
LCIU4BMRC,"1,123",564,2023-03-24,"Overall, recommendations are usually on point however I like the variety of content"
BTL03710M,24,705,2021-12-09,"Honestly, fonts look weird on some screens however too many tabs on the screen"
9NXMKTO6J,"1,155",122,2020-11-15,"More often than not, the feed feels cluttered with promotions"
IGKPLRGGB,"1,633",1637,2020-01-19,"At times, it’s addictive without giving much substance yet the reels pull me in and I lose track of time
 From my side, I’m getting more ads than actual content"
OR6XN6LCP,"13,404",811,2019-03-13,"I guess, it’s hard to stop once I start
 These days, it’s hard to stop once I start"
Q68RTIG7Z,"1,465",109,2017-10-18,"Kind of, it hooks me more than it should
 Recently, I open it for a minute and stay for hours"
6GKABCZLZ,"1,929",1838,2020-06-19,"These days, I’m getting more ads than actual content
 In my experience, too many sponsored reels"
ZSG9VWIEB,"141,778",349,2020-10-12,"Honestly, it’s addictive without giving much substance plus I keep scrolling way longer than I plan
 At times, I end up wasting a lot of time here"
36WKR38K2,"1,487",135,2019-01-18,"These days, the app is smooth and fun to use though great way to stay connected with friends"
7CP4LMJRJ,323,212,2017-08-03,"Overall, too many tabs on the screen yet navigation could be simpler"
6ALUMWFRG,"1,537",1791,2017-08-22,"Not gonna lie, it’s hard to stop once I start however it’s hard to stop once I start
 It feels like, ads interrupt the experience a lot"
037GBUHZO,542,225,2017-06-16,"Lately, I enjoy discovering new creators however stories and reels are entertaining"
W218GAVFX,"1,823",1510,2018-10-07,"I feel like, messages sometimes don’t send properly plus uploads take too long"
UHU4AADQS,"9,408",555,2019-02-07,"Sometimes, my reach has dropped recently and hashtags don’t seem to work well"
XY6WKHVPP,"134,084",1353,2022-04-04,"It feels like, great way to stay connected with friends and stories and reels are entertaining"
IYMENVG3K,"1,490",1115,2022-09-08,"At times, content feels endless and a bit shallow however it’s hard to stop once I start
 It feels like, content feels endless and a bit shallow"
G6DVNQ494,"5,329",405,2016-09-16,"At times, I’m getting more ads than actual content but the ad load feels excessive
 Lately, the ad load feels excessive"
GLB82MOTZ,"114,988",1564,2017-08-26,"Overall, ads are popping up almost every scroll but ads are popping up almost every scroll"
WDXVUGW6M,"25,399",1740,2025-09-08,"Honestly, the reels pull me in and I lose track of time however it’s addictive without giving much substance
 Not gonna lie, it’s addictive without giving much substance however I keep scrolling way longer than I plan"
SE9DN1NZI,"1,809",333,2019-02-23,"Lately, I like the variety of content and the app is smooth and fun to use
 In my experience, recommendations are usually on point so great way to stay connected with friends"
V31IQFG7T,793,678,2024-07-20,"I feel like, the feed is super engaging but low value
 Lately, it’s hard to stop once I start yet I keep scrolling way longer than I plan"
1D5C21O6W,"3,849",291,2017-08-07,"Overall, ads are popping up almost every scroll and ads are popping up almost every scroll"
XMS3RAG0K,"6,672",660,2017-10-26,"Sometimes, ads interrupt the experience a lot and too many sponsored reels
 I feel like, ads interrupt the experience a lot but there are too many ads in between posts"
DLHXBAAC6,209,1210,2016-10-09,"I feel like, design feels inconsistent"
OYC3RWQMM,"1,908",1708,2018-11-21,"Sometimes, I keep scrolling way longer than I plan so it’s addictive without giving much substance
 From my side, I end up wasting a lot of time here however too many quick dopamine hits"
2XLVB9HXK,480,1945,2020-05-12,"Kind of, it’s hard to stop once I start
 I guess, the reels pull me in and I lose track of time but I open it for a minute and stay for hours"
LB0FMITWP,596,1943,2020-06-04,"For me, the ad load feels excessive
 More often than not, sponsored content is overwhelming"
RVFONTYAD,117,333,2020-03-15,"In my experience, I’m getting more ads than actual content however there are too many ads in between posts"
BVTBWGBZ1,"13,517",809,2025-12-29,"I guess, stories and reels are entertaining and the features keep getting better"
16DBJX5Z0,"5,782",699,2017-05-23,"In my experience, messages sometimes don’t send properly so my reach has dropped recently"
YX1ZDNQSA,118,472,2022-03-13,"These days, too many sponsored reels plus sponsored content is overwhelming"
F2CHSNBWI,311,492,2016-10-26,"Not gonna lie, the feed is super engaging but low value
 More often than not, ads interrupt the experience a lot"
K2PTHOWQ1,38,1335,2023-11-20,"At times, it’s hard to stop once I start
 For me, I end up wasting a lot of time here"
HRDU4XSZJ,"1,240",1520,2016-10-17,"Honestly, the feed is super engaging but low value"
DO9KHBA5M,"1,695",1810,2021-08-24,"Tbh, the reels pull me in and I lose track of time and it’s addictive without giving much substance
 Overall, I open it for a minute and stay for hours so content feels endless and a bit shallow"
OKO3VPK2U,"20,832",146,2022-09-12,"These days, recommendations are usually on point plus the features keep getting better"
GNQRBEIIA,"44,426",739,2020-04-16,"I guess, app crashes occasionally so messages sometimes don’t send properly"
YSWZNQ6KT,"1,720",1272,2021-01-16,"For me, followers count seems off"
NO1RBN62N,"1,924",813,2018-06-15,"Recently, I’m getting more ads than actual content
 I guess, the feed feels cluttered with promotions"
6MQBIAFHE,"6,912",746,2023-02-08,"Honestly, ads show up way too frequently
 Tbh, ads are popping up almost every scroll though there are too many ads in between posts"
7K0NT95OS,"1,551",1563,2024-05-14,"At times, too many quick dopamine hits
 From my side, the ad load feels excessive"
5JU26SPHN,19,1074,2021-11-22,"Recently, the ad load feels excessive and the feed feels cluttered with promotions"
E2U2MDA7F,"19,143",643,2022-12-30,"From my side, I end up wasting a lot of time here and I end up wasting a lot of time here
 Tbh, the feed is super engaging but low value though the reels pull me in and I lose track of time"
ARJZK08CT,"121,263",331,2023-03-08,"Not gonna lie, ads show up way too frequently and the ad load feels excessive
 Lately, too many sponsored reels"
WHIFYEMF5,"1,302",1108,2024-01-30,"In my experience, the feed feels cluttered with promotions but ads are popping up almost every scroll
 In my experience, I keep seeing sponsored posts every few swipes"
C33U0JPO9,"9,935",1029,2025-06-11,"Sometimes, icons aren’t intuitive"
R7FA6AHHC,"1,062",821,2018-10-15,"In my experience, sponsored content is overwhelming though ads show up way too frequently"
KG3OJODZ4,"13,342",526,2016-12-17,"I feel like, messages sometimes don’t send properly and notifications are inconsistent"
65TYAGI9U,641,121,2018-02-20,"In my experience, uploads take too long however messages sometimes don’t send properly"
UDLWRFLVR,"1,124",1767,2018-02-08,"Sometimes, the feed feels cluttered with promotions and ads show up way too frequently"
3DWW8DXAJ,"13,675",142,2016-06-21,"Tbh, UI changes are confusing so dark mode could be better"
RJAL1TPNS,"1,662",1073,2023-04-25,"I feel like, recommendations are usually on point but I find useful content regularly"
IRJ6D60AJ,"1,216",538,2021-05-24,"Recently, fonts look weird on some screens though navigation could be simpler"
4HH4WEL9C,881,847,2022-06-27,"In my experience, buttons are hard to find but spacing looks off"
RC85EHPZR,"12,168",1253,2018-04-11,"At times, I open it for a minute and stay for hours and it’s hard to stop once I start"
4GU65S6Y5,"1,668",1040,2020-07-27,"Lately, the feed feels cluttered with promotions and the feed feels cluttered with promotions"
16ZZOILKQ,"12,106",585,2020-01-13,"At times, I open it for a minute and stay for hours plus I open it for a minute and stay for hours"
21EJ2VHAK,"16,119",1217,2017-11-11,"Tbh, sponsored content is overwhelming yet there are too many ads in between posts"
F9E0KLLIR,"1,904",1369,2023-06-30,"In my experience, the feed is super engaging but low value"
VNMD8IYUB,"3,874",1454,2019-11-22,"Sometimes, too many sponsored reels yet too many sponsored reels"
4FGGW1JYK,"125,045",1937,2024-05-17,"I guess, the feed feels cluttered with promotions and ads show up way too frequently
 Overall, ads interrupt the experience a lot so there are too many ads in between posts"
MH4GBLCKU,"1,410",775,2017-03-25,"These days, I keep scrolling way longer than I plan
 It feels like, the ad load feels excessive however ads interrupt the experience a lot"
RY736HXPO,"112,054",786,2017-01-30,"At times, stories and reels are entertaining plus it’s a nice break during the day"
SA4H7ILXI,"90,762",1585,2024-10-13,"Recently, overall a good experience"
8A1ARR3VR,"1,350",1024,2021-02-01,"I guess, I open it for a minute and stay for hours though I keep scrolling way longer than I plan
 Recently, it’s addictive without giving much substance"
U0SL3E6KR,"120,108",389,2019-10-27,"At times, navigation could be simpler"
FU9PXYKM8,"1,521",1676,2019-01-06,"Lately, too many quick dopamine hits
 For me, I end up wasting a lot of time here and too many quick dopamine hits"
A5O47AET8,"10,144",804,2021-01-25,"It feels like, too many quick dopamine hits but I keep scrolling way longer than I plan"
YJFE8UDTT,"1,931",1492,2025-01-06,"In my experience, it’s addictive without giving much substance and I end up wasting a lot of time here"
DBXVH7KAT,"1,375",228,2021-09-27,"More often than not, the feed is super engaging but low value though it’s addictive without giving much substance"
8PIJKEMVG,"95,083",803,2017-06-05,"Kind of, it hooks me more than it should
 Tbh, it’s addictive without giving much substance"
5NCY31ZR7,946,1697,2017-07-17,"Sometimes, I end up wasting a lot of time here so I end up wasting a lot of time here
 Lately, sponsored content is overwhelming"
PY8258J2H,10,197,2025-05-27,"Kind of, ads interrupt the experience a lot but I’m getting more ads than actual content"
2WNGQOHOA,231,1915,2017-03-10,"In my experience, I find useful content regularly however overall a good experience"
I6UK1Y7ZP,828,1721,2019-10-15,"For me, my reach has dropped recently however login issues happen randomly"
LK9UAWWPV,"1,483",814,2016-02-20,"It feels like, login issues happen randomly though uploads take too long"
E5HBHAQEL,"1,339",1133,2018-08-03,"Honestly, ads interrupt the experience a lot"
43XZ6OLBA,"8,610",1952,2018-10-19,"Sometimes, the feed is super engaging but low value and it hooks me more than it should
 Honestly, content feels endless and a bit shallow"
TYESTAZAL,"1,101",364,2022-02-15,"More often than not, it’s a nice break during the day"
0QQXC9U2H,"1,883",210,2025-10-16,"Overall, it’s addictive without giving much substance however I end up wasting a lot of time here
 Kind of, too many sponsored reels and ads show up way too frequently"
QN8PACC1X,"12,393",645,2025-08-06,"I feel like, spacing looks off"
DG3C6SCIV,950,251,2022-01-08,"Tbh, content feels endless and a bit shallow
 It feels like, the reels pull me in and I lose track of time yet the feed is super engaging but low value"
PMADFA0GO,520,1609,2016-08-03,"From my side, I open it for a minute and stay for hours plus it’s addictive without giving much substance
 I guess, the feed feels cluttered with promotions"
4A15F4JM8,"1,909",324,2016-02-05,"Kind of, I’m getting more ads than actual content plus I keep seeing sponsored posts every few swipes"
IW8CYSY8L,"23,886",58,2021-03-16,"In my experience, overall a good experience"
18RWDJ4VT,"1,429",529,2021-05-02,"Not gonna lie, the app is smooth and fun to use"
QI2CLP81L,"121,645",348,2017-08-26,"It feels like, I end up wasting a lot of time here
 Honestly, too many quick dopamine hits"
SYJ3D6M1F,858,1036,2021-05-01,"From my side, it hooks me more than it should however it’s addictive without giving much substance
 Honestly, too many quick dopamine hits"
Z614UMNWE,988,908,2021-11-15,"At times, I keep scrolling way longer than I plan so it’s hard to stop once I start
 Tbh, the feed is super engaging but low value"
D79ZTD3IM,"9,338",1002,2019-01-07,"Tbh, I open it for a minute and stay for hours"
8NVQHL097,"1,464",1748,2021-04-24,"Honestly, content feels endless and a bit shallow but I open it for a minute and stay for hours
 Honestly, I end up wasting a lot of time here"
KVLDHP3A0,950,712,2025-06-18,"I feel like, the features keep getting better however stories and reels are entertaining"
HVMBN4HZW,298,1242,2021-10-15,"More often than not, I enjoy discovering new creators but I find useful content regularly"
MNW6L4M1T,882,1201,2016-03-08,"Lately, the reels pull me in and I lose track of time
 I guess, I keep scrolling way longer than I plan yet too many quick dopamine hits"
BNXDXWBC1,628,478,2018-07-04,"These days, ads interrupt the experience a lot but I’m getting more ads than actual content
 More often than not, ads show up way too frequently"
9T6M7RJBN,"78,868",1307,2016-05-28,"Sometimes, it’s a nice break during the day but it’s a nice break during the day
 Not gonna lie, the features keep getting better plus the features keep getting better"
FDR756SSX,"125,384",1444,2022-05-10,"More often than not, I keep seeing sponsored posts every few swipes
 I guess, I’m getting more ads than actual content"
PATOM287C,"9,623",1881,2016-12-14,"Tbh, I’m getting more ads than actual content but there are too many ads in between posts
 Recently, ads show up way too frequently however ads are popping up almost every scroll"
F4ONB8VZ8,574,1930,2017-03-24,"These days, DMs lag at times though my reach has dropped recently"
NVCE8XPU4,"93,143",1769,2024-07-09,"More often than not, it’s addictive without giving much substance so too many quick dopamine hits
 It feels like, too many sponsored reels"
3QUV5F3FI,674,849,2021-06-13,"It feels like, the layout feels cluttered plus buttons are hard to find"
8WD62JC0V,609,1162,2023-09-05,"Lately, the feed is super engaging but low value
 At times, ads show up way too frequently"
EN4IEDBTF,130,1023,2016-12-17,"For me, fonts look weird on some screens"
F984HZCS7,334,495,2019-10-15,"Honestly, recommendations are usually on point however I enjoy discovering new creators"
UDBFWYJXR,559,491,2024-06-19,"At times, the reels pull me in and I lose track of time and I end up wasting a lot of time here"
JZ1B2R27Y,"1,835",1696,2017-10-12,"I guess, followers count seems off so uploads take too long"
MOE545VYB,440,1872,2025-07-17,"I guess, I keep scrolling way longer than I plan
 Kind of, it hooks me more than it should yet it hooks me more than it should"
I29GPO1QM,"1,086",1145,2022-12-21,"It feels like, the feed feels cluttered with promotions but ads interrupt the experience a lot"
PX2CYOS0F,"1,738",1294,2023-08-09,"For me, I keep scrolling way longer than I plan but content feels endless and a bit shallow
 Tbh, it’s addictive without giving much substance yet content feels endless and a bit shallow"
F4X6VVWNH,"127,809",1875,2017-11-07,"Overall, I’m getting more ads than actual content
 Recently, there are too many ads in between posts"
CLMMVH71H,"6,147",398,2022-03-05,"Sometimes, ads are popping up almost every scroll
 From my side, the ad load feels excessive however I keep seeing sponsored posts every few swipes"
1E2CXV3CX,"58,653",502,2016-03-02,"Tbh, great way to stay connected with friends but great way to stay connected with friends"
PSRRT7DKP,"7,419",1272,2020-03-24,"More often than not, icons aren’t intuitive however UI changes are confusing"
6AVE7E51M,"19,104",1232,2022-04-08,"From my side, sponsored content is overwhelming and the feed feels cluttered with promotions"
40E1JJDZC,"2,458",1431,2024-06-09,"Recently, I like the variety of content"
82YF7QTZ1,"1,171",719,2023-07-16,"At times, too many tabs on the screen however too many tabs on the screen"
781GX5Y7Z,131,1519,2020-06-04,"It feels like, sponsored content is overwhelming"
RV23U65XN,286,298,2016-03-31,"Recently, I keep scrolling way longer than I plan plus content feels endless and a bit shallow
 Recently, I’m getting more ads than actual content"
AIC0DHNHW,610,1762,2021-03-14,"Lately, ads show up way too frequently
 Honestly, there are too many ads in between posts and the feed feels cluttered with promotions"
